{
  "text_preview": "Programming LanguagesPython (pandas, numpy, matplotlib)R (dplyr, ggplot2, Regression Modelling)C, C++, JavaDatabasesSQL (MySQL)MongoDBData Visualisation and ToolsTableau, Git, ExcelSecond-year Computer Science and Business student at NTU with a strong foundation and passion indata analytics for business decision-making. Possesses a keen interest in applying technology,including emerging financial technologies like blockchain, to solve complex business problems.Seeking an entry-level Data Analyst...",
  "email": "poonjoash@gmail.com",
  "phone": "+65 9230 6392",
  "skills": [
    "Python",
    "pandas",
    "numpy",
    "matplotlib",
    "R",
    "dplyr",
    "ggplot2",
    "Regression Modelling",
    "C",
    "C++",
    "Java",
    "SQL",
    "MySQL",
    "MongoDB",
    "Tableau",
    "Git",
    "Excel",
    "PostgreSQL",
    "blockchain",
    "data analytics"
  ],
  "education": [
    {
      "degree": "Double Degree in Business and Computer Science",
      "major": "Computer Science and Business",
      "school": "Nanyang Technological University",
      "year": "2024 - present"
    },
    {
      "degree": "GCE \"A\" Levels",
      "major": null,
      "school": "Hwa Chong Institution",
      "year": "2016 - 2021"
    }
  ],
  "work_experience": [
    {
      "role": "Research Analyst",
      "company": "Blockchain@NTU",
      "duration": "Aug 2025 - Present"
    },
    {
      "role": "Co-founder",
      "company": "Hestia",
      "duration": null
    },
    {
      "role": "Armour Maintenance Specialist",
      "company": "Singapore Armed Forces",
      "duration": "Jan 2022 - Nov 2023"
    }
  ],
  "raw_text": "Programming LanguagesPython (pandas, numpy, matplotlib)R (dplyr, ggplot2, Regression Modelling)C, C++, JavaDatabasesSQL (MySQL)MongoDBData Visualisation and ToolsTableau, Git, ExcelSecond-year Computer Science and Business student at NTU with a strong foundation and passion indata analytics for business decision-making. Possesses a keen interest in applying technology,including emerging financial technologies like blockchain, to solve complex business problems.Seeking an entry-level Data Analyst internship where I can develop hands-on experience and use datainsights to inform strategic decisions. I am eager to contribute tangible value by collaborating withteams to draw meaningful insights from raw data.Hwa Chong Institution (2016 - 2021)Blockchain@NTUResearch AnalystSingapore Armed ForcesArmour Maintenance SpecialistLed a section of 6 men in ensuring the operational readiness of a fleet of >20 armored vehicles.Completed ad-hoc vehicle repairs within tight time constraints, ensuring high standards of safetyand workmanship.Conducted training for junior batches to impart technical knowledge and experience as well asensure adherence to strict regimental standards.Jan 2022 - Nov 2023ABOUT MYSELF+65 9230 6392 \u00b7 poonjoash@gmail.com777 Ang Mo Kio Ave 2, Singapore 567800Joash PoonWORK EXPERIENCEEDUCATION & AWARDSEXTRACURRICULAR ACTIVITIESPROJECTSGCE \u201cA\u201d LevelsFirst Place, Future Problem Solving ProgramInternationalHwa Chong Good Progress AwardTECHNICAL SKILLSNanyang Technological University (2024 -present)Double Degree in Business and ComputerScienceHestiaCo-founderCo-founded a web platform connecting home-based businesses to Singaporeans.Built and designed analytics dashboards using PostgreSQL data to provide creators with keybusiness metrics (e.g., sales growth, customer retention) to inform brand strategy.Gender Pay Gap Analysis in Academic SalariesTeam MemberAnalyzed academic salary data using R libraries including dplyr, car and ggplot2 for dataprocessing, regression modeling, and visualization. Created layered plots and regressiondiagnostics to explore gender-related salary trends across departments and experience levels.Analyzed blockchain data and trends across various protocols (e.g., DeFi) to identify key marketpatterns and developments.Translated complex technical insights into digestible articles for the club\u2019s newsletter, reachingclose to 100 subscribers.Aug 2025 - Present\f"
}